,id,date,dateYear,dateMonth,dateDay,rating,userName,content
201,202,20200722,2020,07,22,4,이승민,삼성헬스로 운동 및 다이어트에 아주 큰도움 받았습니다. 감사합니다. ☆개선 및 추가보완 희망사항☆ 1. 헬스 어플 안에 질문하기 베너 설치했음 좋겠음 2. 운동하기 중 달리기를 가장많이 사용하는데 인기 프로그램에 마라톤기능이 포함된 훈련코스같은게 반영되면 좋을것같습니다. 평소에 내가 뛰는 페이스를 분석해서 나에게 맞는 훈련일지와 방법을 제시해주는거죠 아마 대부분 러너라면 나이키 런클럽이나 맵마이런 등을 많이 사용하실것같은데....그런부분까지 다 흡수한다면 아주 좋은? 어플이 될것같습니다☺
202,203,20200622,2020,06,22,4,CA,기본적으로 폰 들고 하는 활동들을 추적할수 있어서 유용하게 잘 사용중입니다 ~ 폰으로만 체크하면 상관없는데 아쉬운 점이 점 있어요 제가 운동용 워치를 사용중인데 가민이나 순토 처럼 많이 쓰는 스포츠 워치와 연동이 안돼서 많이 아쉬워요 실제 격한 운동을 할때 폰을 가지고 다니기는 불편해서 워치 이용하면서는 활동 체크가 안돼네요 ㅜ 스트라바 연동 외에 다른 어플과도 연동이 되면 더 유용할것 같습니다
203,204,20180912,2018,09,12,1,Google 사용자,"업데이트 이후 항목이 가로로 풀 사이즈가 되어서, 한눈에 볼수 없고 찾기가 매우 복잡합니다. 다양한 항목을 관리하고 추가 해야 하는데, 도데체 가시성이 없습니다. 예전처럼 그리드 형식으로 항목을 좀 더 한눈에 볼 수 있게 하던가 탭 등을 이용하여 그룹핑을 하던가, 이런 옵션을 주던가 대책이 필요해 보입니다."
204,205,20200609,2020,06,09,5,sunghyun kim,그동안 방치하다가 운동 및 식단하면서 정말잘쓰고 있어요 감사합니다 건의사항으로 1. 달리기-페이스목표에서 준비운동과 정리운동부분이 자동으로 설정이되서 달리기를 측정해보고 싶을때 아쉽내요 이분을 목표설정시 없에거나 뛰어넘을수 있게 부탁드려요 (3km달리기하면서 처음부터 끝까지 목소리 페이스 지원을 받으면서 뛰고 싶은대 앞뒤로 준비운동이 있어서 시간을 측정하기 아쉽내요) 2. 1번과 비슷한 부분인대 달리기-페이스목표에서 3km를 13분이내로 페이스를 맞추고 싶은대 20분까지만 설정이 되게해서 아쉬워요 제가 군인이다 보니 해당 거리를 쉼없이 뛰면서 속도를 올리고 싶어서 해당설정이 가능했으면 하내요!
205,206,20210909,2021,09,09,5,윤지훈,"정말 좋은데요.. 일부 개선이 필요한 부분이 있습니다. 1. 걷기 기록을 측정할려고 하는데, 실수로 차를 탄 부분까지 포함되네요. 속도 상한을 초과하면 걷기 기록에서 제외하는 옵션이 있으면 좋겠습니다.^^ 2. GPX화일 생성까지는 좋습니다만, 생성된GPX화일로 뭘 할수 있었으면 좋겠습니다. 따라걷기를 한다던지..."
206,207,20200809,2020,08,09,1,jaeho kim,"어플리케이션 업데이트를 왜 했는지 이해가 안갑니다. 이전엔 체중관리 기능을 통해 목표체중과 감량기간에 따른 권장칼로리가 자동으로 설정이 가능했고 보면서 식사량에 따라 운동량도 같이 조절가능했는데 왜 삭제되었는지 모르겠습니다. 그러고 추가된 기능이 매우 신박한 것이면 모를까 산소포화도 측정과 수면패턴분석이네요. 산소포화도 측정은 갤럭시7이 현역이던 시절에 있었다가 날라갔던 기능이고 수면패턴은 소수의 사람들만 쓰고 그들마저 이미 있던 어플서 다 써서 쓸모가 없는데 너무 진부한거아닙니까? 갤럭시 워치3가 내놓으면서 산소포화도측정이랑 수면패턴, 심전도, 혈당같이 웨어러블 장비가 없으면 못쓰거나 효과가 반감하는 기능들, 의료기관서 보면 좋아할법한 기능들을 잔뜩 넣으면서 용량이 부족해진 결과 날린건지 아니면 음식과 운동기능서 각각 일부분을 지원하니 이정돈 없어도 된다는 안일한 생각으로 날린건지 몰라도 고객이 원하는 방향은 아닌것같습니다. 하다못해 다운그레이드라도 시킬 수 있게 해주십쇼"
207,208,20220227,2022,02,27,4,Kwansop Park,"삼성헬스 앱을 정말 잘 사용하고있습니다. 저는 자전거타기 를 좋아해서 앱을 이용하여 제 운동 데이터 관리를 하고있지만, 취미생활이기 때문에 전문적이지는 않습니다.. 스트라바 라는 좋은 앱도 있지만 삼성헬스도 장점이 참 많습니다.. 건의사항이 있는데 자전거타기에서 공유 기능에서 '누적고도'도 선택항목으로 넣어주시면 감사하겠습니다... '누적고도'는 라이더들에게 다른 항목에 비해 비중이 높다고 할 수 있겠습니다... 감사합니다.."
208,209,20201208,2020,12,08,3,r j,좋아요. 미밴드 쓰다가 갤럭시핏으로 바꾸면서 쓰는데 삼성핸드폰 사용하는 분이시면 편하실거예요. 그런데 운동쪽에 실내자전거가 추가되었으면 좋겠어요. 실내자전거는 거리측정이 안되서 칼로리같은게 측정이 안되는데 아쉽습니다. 거리측정이 안되면 운동시간만 측정되고 칼로리 계산이 안되더라구요. 요즘에는 실내운동기구를 쓰는 사람이 많은 만큼 기능이 생겼으면 좋겠어요.
209,210,20200516,2020,05,16,4,뽀담,"수면시간을 알수있는 것도 좋고 이 어플을 깔고 나서 새로 알게된 것이 많아지고 정말 편리했는데 제가 핸드폰을 소리키고 뭘 보면서 움직이거나 하면 기계음이 ""운동을 시작하여 습니다, 운동을 멈쳤습니다, 이렇게 말하더라구요 이게 너무 시끄럽고 불편해서 소리를 없에고 싶어서 어플 설정에도 들어가보고 했는데 못찾겠더라구요 이게 한가지 단점인거 같습니다 그래도 편리하고 좋아요 소리 없에는 방법을 알려주세요ㅜㅠ"
210,211,20201202,2020,12,02,3,콩딱,"이전에 잘 사용하던 목표 칼로리 설정 항목이 사라졌네요. 소비칼로리와 섭취칼로리가 잘 나와있어, 기간내 체중 관리에 용이했는데 말이죠. 많은 사람들이 해당 항목이 사라진것에 있어 의문을 갖고 있는데도 불구하고 돌아오는 답변이 대체 항목(활동, 음식) 추천이라 참 슬프네요... 해당 항목이 다시 돌아왔으면 좋겠습니다. 부디 다시 추가해주시면 감사하겠습니다."
211,212,20220301,2022,03,01,4,김소라,하루하루 내 건강상태를 표시하고 비교할 수 있는 기능이 추가 됬으면 좋겠어요 요새 기분을 달력에 이모티콘으로 표시하는 앱이 많이 나왔는데 그것처럼 한눈에 보이도록요!!! 간단히 메모기능도 있다면 더없이 좋을 것 같아요. 상태 기록하면서 페이스 조절도 가능하고 동기부여 내 몸 알기 등 많은 장점이 생길 것 같아요
212,213,20190501,2019,05,01,4,Google 사용자,"앞으로 나오는 삼성 기기를 이용하여서도 기존에 쓰던 산소포화도 기능을 이용할 수 있으면 좋겠고,(현재 갤럭시s10, 워치 액티브는 기능이 빠졌네요) 또한 식단입력 부분에서 사용자가 입력한 건강정보에 기반한 기초대사량 등에 기반하여 필요섭취칼로리 등을 알려주면 좋을것 같습니다. 혹시 그게 어렵다면, 따로 앱내 결제를 하더라도 인바디 결과지를 입력하여 추천 운동이나 추천 식단, 혹은 정확한 필요섭취칼로리 등을 계산할 수 있다면 더욱 좋을것 같습니다!"
213,214,20200405,2020,04,05,5,Google 사용자,삼섬헬스 잘쓰고있는데요 하루 걷기 측정 만보기용으로 사용중이에요 위젯에서 걸음수 정지 실행 버튼 가능하게 할 수 없을까요? 운전을 수시로해서 내리고 탈때마다 어플들어가서 일시정지 시작 누르는게 상당히 불편해서요 위젯에서 바로 할 수 있게 조정되면 엄청 편할 것 같습니다.
214,215,20220419,2022,04,19,3,루비Ruby,안녕하세요! 평가를 적어보겠습니다. 우선 다른 어플들에 비해 기능들이 꽤 다양하게 많이 있어서 사용할 때 편했어요.그런데 작은 버그들이 여럿 있는 건 같아 좀 아쉬웠습니다. 특히 갤럭시 워치가 없으면 심박수를 잴 수 없다는 것이 많이 아쉬웠네요. 다른 것들은 다른 어플어 비해 사용하기 편리했습니다. 자잘한 버그들만 고쳐주신다면 좋은 앱인 같습니다!
215,216,20210422,2021,04,22,4,grimbee,"업데이트 후.. 1) 영양정보가 좀 이상해졌네요. 특히 나트륨은 실제 수치는 300 정도인데 그래프는 3단계 빨간색까지 경고수준으로 표시 됩니다. 수정이 필요한 것 같네요!! 2) 구글 피트니스에서 수면정보를 연동시켜 사용중인데, 수면효율만 항상 '0'로 표시 됩니다. 왜 그럴까요? 다른 항목은 잘 연동 됩니다. 3) 오므론 혈압계는 모두 등록 가능토록 수용해 주세요. 일부만 되니까 불편 하네요. 저는 HEM-7280T를 쓰는데, 오므론 앱에서 연동은 잘 되고 혈압 데이터도 잘 넘어옵니다. 삼성헬스에 악세서리로 추가등록만 된다면 연동할 필요없이 더 편리하게 쓸 수 있을텐데 아쉽네요. 4) 체질량계도 마찬가지 경우로, 보건소 건강관리 프로그램에서 받은 PICOOC 체질량계가 등록이 안되니까 별수없이 데이터 연동으로 쓰고 있어요. 타사 기기도 웬만하면 등록해서 쓸 수 있는 넓은 아량(호환성)을 보여주면 삼성헬스 사용자들이 더 확장 되지 않을까요?"
216,217,20200904,2020,09,04,5,배용운,"갤럭시워치에서 삼성헬스를 구동해서 런닝을하고있습니다. 개선요망사항은 1. 런닝중 항상 켜있을것 2. 런닝타임, 런닝거리, 최근 10초/1분 런닝페이스(min/km)를 엄청 큰 글씨로 단번에 읽을수 있도록해주세요. 지금 글씨와 화면구성은 달리면서 읽을수 없어요. 부탁합니다."
217,218,20181022,2018,10,22,5,Google 사용자,"아주 실용적으로 잘 사용하고있습니다. 다만 한가지 문제점이 있는데 오른 층수를 표시해주는 트래커가 작동하질 않습니다. 달리기운동을 할때 고도표시는 나오는데, 계단오르기 운동후에 오른 층수가 단 한층도 카운트 되질 않습니다. 예전에 삼성 기어핏과 연동하여 사용할때는 층수표시가 되었었는데 기어핏을 동생에게 주고 제 핸드폰에서 기너핏을 해제하고 나서는 이상하게 앱에서 오른 층수만 표기되지 않는것 같습니다. 해결방법좀 알려주세요."
218,219,20210115,2021,01,15,5,Yu Lo,달리기 페이스 모드에 고강도 인터벌 모드 추가해주세요 제발 ㅠㅠ 1~2분간 하고 다시 1~3분간 가볍게 뛰며 반복할 수 있었으면 좋겠어요. 현재는 자율적으로 설정하는 기능에 한계가 있어서 불편합니다. 그리고 음식 카테고리에 공복 시간 체크하는 기능도 추가 되었으면 좋겠습니다!!
219,220,20200910,2020,09,10,4,박은경,"너무나 잘 사용하고 있습니다만 업데이트 이후 위젯에서 전체걸음과 업데이트 항목이 화면을 너무 지저분하게 만들어 거슬리네요.. 선택사항으로 넣어주셨으면 좋겠습니다. 좋은 어플 만들어 주셔서 감사합니다. +답변 감사합니다. 홈화면에 있는 위젯을 이야기 한 것인데, 그것도 변경 가능한지요.."
220,221,20210330,2021,03,30,5,야르,"두달여 동안 사용해본 결과 아주 유용하고 좋은 어플입니다 덕분에 운동도 더 열심히 하고있습니다 다만 최근 업데이트이후 알림소리가 들리지 않습니다 걷기 실행 시키고 운동하다보면 ""1키로 미터 지났습니다 평균속도xx, 심박수yy... ."" 이렇게 알려주어 운동에 도움이 되었는데 최근엔 이 알림소리가 나지 않습니다 어플에 알람기능은 on 으로 켜놓은 상태입니다 혹시 제가 빼먹은것이 있거나 방법이 있는지요?"
221,222,20220908,2022,09,08,4,Life Enjoy,와치와 함께 잘 사용하고 있습니다. 그런데 최근 투게더를 보면 어느날 갑자기 걸음이 잔날보다 몇천보 또는 만보 가까이 줄어들어서 표시됩니다. 투게더에 있는 분들 걸음이 모두 동일학 전날과 달리 감소되서 나타나고 순위도 바뀌어 보이는데 문제가 뭔가요?
222,223,20210119,2021,01,19,1,Kate Shin,몇 리뷰에서 보이는 것과 같은 문제가 저한테도 발생하네요. 갤럭시 핏2 사용을 위해 삼성헬스를 받았는데 로그인 이슈 때문에 쓸 수가 없네요. 로그인 없이도 사용 가능한 버전을 배포해주시거나 로그인 이슈가 해결될 때까지 강제 로그인 기능 적용을 보류해주시면 좋겠습니다. 아니면 로그인 가능하게 빠른 처리 좀 부탁드리겠습니다.
223,224,20220723,2022,07,23,1,ee. eoee (난쟁이),"기존에 다니는 병원에서 만들어진 앱을 이용하려면 삼성헬스를 깔아야하는데 이건 뭐 깔고나면 쿠팡도 로딩이 오래걸리거나 안넘어가는 현상이 있고, 또 가만히 있다가 '삼성헬스 앱사용이 중지됐다'는 안내와 함께 모든 화면이 초기화됩니다. 업데이트를 한건가요 뭔가요. 이 모든 증상은 삼성헬스 어플을 지우면 정상화되네요. 다른건 몰라도 병원앱을 써야 하는데 참... 난감하네요."
224,225,20220521,2022,05,21,4,밀크티,언제부턴가 앱 사용후 기록 보는게 너무 느려졌습니다~ 전에는 체감상 1초도 안 걸리던 것이 지금은 30초는 넘게 기다려야 뜹니다. 갭이 너무 큽니다~ 갑자기 이러니 너무 당황스럽고 불편합니다~ 처음엔 앱 오류인지 알았습니다~ 그런데 한참 지난후 보니 기록이 보이더군요~~ 빠른 개선 바랍니다
225,226,20220517,2022,05,17,4,박미경,질문이 있어 올립니다. 3일전에 갤워치4(gps) 구매해서 사용중인데 워치와 폰의 걸음수가 다르게 나옵니다. Galaxy Wearable에는 워치4가 연결됨으로 나오는데 삼성헬스 앱에서 따로 연동을 해야하나요? 연동 시키는 방법이 따로 있나요? 삼성헬스 앱에서 설정->액세서리->등록된 액세서리에 워치4가 안나옵니다. 그래서 등록을 하려고하면 워치4가 나오긴하는데 터치를 하면 Galaxy Wearable로 넘어갑니다. 꼭 워치4와 폰의 걸음수가 같아지는 방법 좀 알려주세요.
226,227,20220514,2022,05,14,3,ᄀᄆᄌ,리뷰라기 보다는 문의사항있어서 글 남깁니다. 제폰은 s10이고 친구는 그 다음버전인듯 한데 앱항목이 다른 이유가 뭘까요? 저는 체중체성분/물/일일활동인데 친구는 체중체성분/심박수/스트레스/물.. 추가로 더 있어요. 휴대폰 사양차이인가요? 같은 삼성폰앱인데 너무 궁금합니다!! 수고하세요!
227,228,20220608,2022,06,08,3,곽동은,"몇 년째 삼성헬스로 걷기운동 체크 중인데 5월말경부터 걷기속도와 거리에 대한 정도가 많이 차이가 나네요. 오늘 아침 1시간 35분 동안 걸었는데 속도 그래프는 6km/h 이하로 내려간적이 없는데, 평균시속은 4.3km 나오네요. 체감상으로 현재속도는 높게 나오는거 같고 거리는 작게 나타나는 것 같습니다. 개선 부탁드리겠습니다."
228,229,20220521,2022,05,21,3,JISOO KIM,"수영 기능 관련해서 딱 두가지만 개선되었으면 좋겠습니다. 1. 갤핏 착용하고 수영시 휴식시간과 운동시간 구분이 안됩니다. 예) 25m풀 기준, 왕복1분 페이스로 1바퀴 돌고 30초 휴식후에 1바퀴 돌면 25m 구간기록이 다음과 같이 기록됩니다 1구간 30초 2구간 30초 3구간 60초 4구간 30초 휴식후 첫 랩 기록이 휴식시간과 합쳐져 부정확하게 측정됩니다. 2. 이게 가장 큰 문제라고 생각되는데 구간기록을 휴식시간 단위로 잘라서 보여주는 기능이 있었으면 합니다. 자유형 500m를 돌고나서 휴식후 다시 돌 경우 처음 500m 기록을 보려면 25m 20구간의 모든 기록을 일일히 더해야 합니다;;;; 다른 수영관련 웨어러블 기기는 기본으로 지원하는 기능인데 갤럭시핏에서는 지원이 되지 않아 좀 많이 당황스럽습니다... 500m - o초 휴식 - o초 300m - o초 휴식 - o초 이정도 기능이라도 지원되었으면 하는 바람입니다. 수영관련해는 거의 방수되는 만보기 수준이에요."
229,230,20220603,2022,06,03,5,MY NAME IS,현재 동작 잘되며 문제 없이 잘 사용하고 있습니다. 운동 기록에 소모 칼로리가 비정상적으로 계산되어 하루 소모 칼로리에 오류가 있습니다. 6키로 걷기하면 통상 350~400kcal인데 800kcal가 넘게 기록됩니다. 확인 부탁드립니다. 안내해 주신대로 프로필에 성별이 누락되어 오류가 있었네요. 지금은 정상 동작합니다. 감사합니다.
230,231,20220516,2022,05,16,4,Sang-joon Park,"매일 1만보 걷기에 삼성헬스가 많은 도움을 주고 있습니다. 더 잘 사용하기 위해 워치도 구입했으니까요. 그.런.데. 첨엔 안 그랬었던 거 같은데, 목표 4km 설정하고 0.5km 걸으면 얘가 ""0.6km 걸었습니다... 3.6km 남았습니다."" 뭐 이런 식으로 음성 안내를 합니다. 홍길동이 아닌 삼성헬스가 왜 X.5를 X.5 라고 부르지 못 하는 걸까요? 제가 뭘 잘못 한 걸까요?"
231,232,20220620,2022,06,20,4,BoSung Seo,노트20 울트라사용중입니다. 웨어러블 없이 스마트폰을 직접들고 걷기와 달리기를 하는데요. 같은거리를 걷기로하고 달리면 속도와거리등 측정이 달리기로 하고 측정 했을때와 오차가 큽니다. 개선해 주세요.
232,233,20220625,2022,06,25,3,Luna “서연” Nahm,"2년 전부터 절대 업댓 안한다. S헬스 런칭때부터 사용해 왔는데, 경험과 리뷰 보면 참 한숨이. 메뉴, 옵션 확확 갈아엎고 연동 악세서리, 앱 뒤집히는 업댓보다는 가벼운 버그 놔두고 쓰는 게 나은 사용자 입장. 업댓하는 거 보면 실험받고 데이터 내주는 기분."
233,234,20220605,2022,06,05,3,chaeyoon han,"갤럭시워치 라이딩모드 4시간정도 사용하면 배터리가 0%가되어요.... 운동하라고 만든 웨어러블 기기인데 지속시간이 너무 짧고, 중간에 꺼지면 기록도 다 날아가서 불편해요. 기능 업데이트 시급합니자."
234,235,20200603,2020,06,03,4,배철민,"삼성헬스가 최근들어 업데이트 되면서 다양한 기능들이 추가되어 잘 사용하고 있습니다. 한가지 바라는 점은 '음식 추가' 기능에서 좀더 다양한 측정 단위들이 있으면 좋겠습니다. 현재는 쌀밥 1인분 200g, kcal 정도의 측정 단위만 사용할 수 있는데, 작은 접시, 반찬접시, 큰술, 컵 등 더 다양한 측정단위가 있다면 식사량을 기록할 때 더 편리할 것 같습니다."
235,236,20211211,2021,12,11,1,윤서영,앱 업데이트를 할때마다 점점 더 불편해지는거 같아요. 걸음수를 주로 보는데 어디 근처에서 걸었는지 대략적으로 보여주는 지도도 없어지고 속도가 변화하면 세세하게 어떻게 바뀌었는지 보여주는 표도 없어지더니... 이제는 걸음을 월별로 보여주는 표는 15년도부터 보이기시작해 이번달 수치를 보고싶으면 몇번을 년도를 넘겨야됩니다. 반대로 최신부터 보여줘야 정상아닌가요? 이부분 수정해주셨으면좋겠습니다.
236,237,20190122,2019,01,22,1,Google 사용자,"아래 내용 관련하여 수정을 왜 안해 주는지 이해가 안가네요. 이번 업데이트에서 개선 할 줄 알았는데 여전하네. 완전 실망이네요. 최근 업데이트 이후 혈압 데이터 내보내기에서 최근 2주 선택후 데이터 내보내기하면 3개월분 데이터가 생성되네요. PDF, EXCEL 둘다 확인후 수정해 주세요. 노트8 사용자입니다. 1개월, 2개월, 3개월은 이상 없고요. 12월 2일까지는 정상 데이터 내보내기 됨(최근 2주) 수정해 주세요."
237,238,20190719,2019,07,19,4,Google 사용자,잘쓰고 있으나 식단 조회할때 좀 아쉽습니다. 야채나 과일등을 입력할때 칼륨등의 영양정보는 빠진게 아주 많은데 중요도가 낮은 성분도 아닌데...누락된 정보가 많아 좀 그래요. 워낙 식품의 종류가 다양하겠지만. 대표적인과일과 야채의 영양정보만이라도 업데이트 해주시면 참 좋을것 같습니다.
238,239,20190221,2019,02,21,1,Google 사용자,"걷기하는데, 중간에 자꾸 일시정지되서는 앱 자체가 먹통됨. 핸드폰 리부팅하고, 앱 껐다 켜기를 수회 반복해도 먹통 그대로임. 그래서 지금 앱 제거 후 다시 깔려는 중. 기존 내 운동기록들 다 날아가는 건 아닌지.. 그러면 다른 앱으로 바꿀 예정. 신뢰가 안가기 때문. --------------------------------- 아래 samsunng에서 써놓은 답변글은 제가 쓴 글을 도통 이해 못했거나, 아예 이해하고 싶지 않은 건가요? 일시정지가 되서는 그 상태 그대로 어떠한 반응도 없이 먹통이 되어서, 아무리 다른 설정 버튼을 누르고, 앱을 다시 실행시키고, 핸폰을 껐다가 켜도 어떠한 반응도 없이 그 상태 그대로 멈춰있다는 소리입니다. 그러니 앱을 삭제하고 다시 까는 수 밖에 다른 방법이 있을까요?"
239,240,20201020,2020,10,20,1,이초아,업데이트 이후 걸음수 측정이 이상함 ㅡㅡ 최적화모드로 사용중이 아님에도 평소보다 1/2 줄어서 기록됨... 친구랑 기록 대결중인데 한시간 걸엇을때 7~8천 걸음이 기록됬는데 2시간 걸으니까 7~8천걸음 걸었다고 인식됨.. 근데 친구는 업데이트를 안해서 인식 제대로 되는듯.. 빨리 개선을 해서 재 업데이트좀 내주세요.. 이럴거면 뭐하러 업데이트함.. 안하고 말지 ㅡㅡ 이런줄 모르고 업데이트해서 걸음 손실 장난아니네요?
240,241,20201004,2020,10,04,5,문숙희,다 좋아요 그런데 자전거 탈때 워치3의 심박데이타를 못서서 아쉽네요. FIT를 또살수도 없고 워치3가 ANT+를 지원하지 않아 케이던스 센서도 연결안되고 전화기와 시계에 자전거 따로 시작해서 동일시간대 운동이 2번 기록으로 남으니 동일시간대 동일운동은 합치는 기능이라도 넣어 주세요
241,242,20220328,2022,03,28,4,yoonho park,워치4로 하이킹 기능을 주로 사용하는데 하이킹 기록들의 전체적인 운동강도를 파악할때 거리외에 누적고도 정보가 있으면 좋을거 같습니다. 하이킹 관련 어플 대다수가 누적고도 정보를 제공하는데 삼성헬스만 없는것 같아서 아쉽네요~ 다음 업데이트에 반영되었으면 좋겠습니다~^^
242,243,20200808,2020,08,08,1,전영동,"이번 업데이트 후 체중계(mi scale2)와 연동된 데이타가 오류가 있습니다. 예를들면 80kg으로 체중계에 표시되는데 삼성헬스 어플에는 800kg으로 인지/기록됩니다. 어플을 다시 설치해보기도 하고, 핸드폰과 체중계 on/off 반복해도 계속 문제 발생합니다. 체중계는 샤오미 mi scale2입니다."
243,244,20220308,2022,03,08,3,SeokBeom Kim,워치4에서 코치와 함께 달리기 진행시에 유투브뮤직으로 듣는 음악 볼륨이 자꾸 바뀌어요. 코치 음성이 나올때 미디어 볼륨을 줄였다가 다시 복구 시킬때 이전 볼륨이 아닌 설정된 볼륨으로 돌아가는게 아닌가 싶네요. 근데 소리 너무 커져서 귀 아프고 매번 다시 조절해야해서 불편해요.
244,245,20190327,2019,03,27,1,Google 사용자,멀쩡히 되던 것이 갑자기 어느 순간부터 실행하자마자 앱이 중지되었습니다가 뜨며 종료됩니다. 데이터를 삭제해보고 앱을 재설치해보고 했지만 여전히 실행이 안 됩니다. 삼성 멤버스를 설치해보라길래 그러려고 했는데 안드로이드 7.0인데 삼성멤버스 호환기종도 아니라고 뜹니다. 기종은 sm-a800s입니다.
245,246,20200807,2020,08,07,1,조양,업데이 후 실행이 안돼요.플레이 스토어에 가서 삭제하고 다시 다운받고 실행할 땐 되는데 다운받은 삼성헬스로 들어가면 중지되었다고 실행중지 의견 보내기가 계속 뜹니다. 그래서 애니핏 연동이 안되어 수십번 삭제하고 다운받고 했습니다. 안드로이드7.0 이며 업데이트 이후 실행이 안돼요. 해결 방법이어떤게 있을까요??
246,247,20210211,2021,02,11,1,Name_Less_King (Gwynbleidd),"갤럭시 S7사용자입니다. 얼마전부터 S헬스가 멋대로 계속 켜지는 현상이 발생해서 앱을 아예 삭제 했더니, 이제 카메라를 켤때나 다른 앱을을 켤때마다 띠링 띠링 하면서 S헬스 알림음이 무한으로 반복 됩니다. 앱을 지워도 이러니 어떻게 방법이 없네요 공장 초기화를 해야할까요? 정말 짜증나는 앱이고 왜 이딴걸 만든지 모르겠습니다"
