,id,date,dateYear,dateMonth,dateDay,rating,userName,content
438,439,20200807,2020,08,07,3,sein lee,사실 삼성헬스 아주 잘 쓰고 있었어요 그런데 업뎃으로 인해 '체중관리' 기능이 없어져서 많이 불편해요 예전엔 한눈에 활동량 음십섭취량을 비교하고 운동을 덜할지 단백질 보충할지 판단했는데 지금은 운동량 따로 음식섭취량 따로 각각 탭 가서 확인하고 계산하네요.. 사용자가 직접 입력한 데이터로 깔끔하게 정리한? 보기좋은 기능인데 왜 사용자를 더 불편하게 삭제했는지... 이제까지 사용한 이력도있고 다른 앱으로 갈아타기도 귀찮고 좀 속상해요.. 이 체중관리 기능이 다시 생겼으면 좋겠네요 (음식탭 체중탭가서 확인하는법은 압니다 그거 하나하나 확인하는게 번거로워서 쓰는 글이에요)
439,440,20190320,2019,03,20,4,Google 사용자,삼성 기기가 있는 계열의 디바이스는 그 기기와 앱들만 연동되는 것이 불편해요. 예전엔 핏빗 계열 됐다고 본 것 같은데 기어류 나오니까 빠진 것 같더라구요. 수면이나 걸음수가 실제와 많이 다르게 반영되지만 불편을 감안하고 씁니다.
440,441,20200711,2020,07,11,4,Wooseog Won,잘 사용하고 있는 사용자입니다. 기기를 변경해서 다시 사용하고 있는데요. 음성 안내의 속도가 너무 빠릅니다. 음성안내가 2배속 정도는 되는 느낌입니다. 음성안내의 속도 조절은 어떻게 하는지요? 알려주시길 바랍니다.
441,442,20220328,2022,03,28,4,최인숙,"매일 걷기 운동을 갤럭시노트20과 워치4를 연동하여 사용하고 있는데 1km 지날 때 마다 거리와 심박수 등을 알려주는데 1~4km까지는 문제가 없는데, 5km 지점 알림 음성이 6km로 안내됩니다. 6km는 정상으로 또 6km로 안내하는데, 5km만 6km로 안내되는듯 합니다. 메일로 보냈는데 읽지도 않고 있어 여기에 또 작성해 봅니다."
442,443,20210114,2021,01,14,4,심현,"오늘 아침에 업데이트 되어 시각적으로 많이 개선될걸로 보입니다. 그런데 식사 매뉴에서 탄수화물, 지방, 단백질의 총 섭취량이 총량으로 합산되어 나왔는데, 지금은 비율로만 나오네요...물론 개별 식사별로 들어가면 섭취량이 나오는데 하루 전체 합산한 섭취량이 기존에는 나왔었는데 이번에 없어졌습니다. 그 부분 다시 복구될 수 있는지 답변 부탁드립니다."
443,444,20220223,2022,02,23,2,SK Kim,"지난번 업데이트후 음식 검색때 종종 앱크래시가 나더니, 이번 업데이트후에는 아예 폰 리부팅이 계속 일어나서 입력이 거의 힘들 지경입니다 그리고 현재까지 소모중인 칼로리의 확인이나 운동별 데이터의 직접입력까지 필요한 단계가 불필요하게 늘어 접근성이 무척 나빠졌습니다 추가로, 앱 내 음식 검색뿐 아니라 다른 앱의 알람푸쉬와의 메모리 충돌 여부도 의심되니 확인부탁드립니다"
444,445,20200811,2020,08,11,5,민만식,"삼성헬스 앱으로 다운받아서 운동을 해보니 정말 감동적이고 좋습니다, 그리고또 자동으로 맞혀서 체크 되니 그 것도 매우 훌륭합니다, 자전거타고 달리는 시간이나 걷는 것도 자동도 되고 본인이 맞혀서 해주니 정말 좋아요 감사합니다, 적극적으로 추천하고 싶어요 %^!^% 삼성헬스 매우 좋아유 ㅎ!ㅎ"
445,446,20190402,2019,04,02,4,Google 사용자,"삼성헬스 이용해서 열심히 운동 중이고, 유용하게 사용하고 있습니디. 그런데 28일 오류 이후로 운동체크 기능에서 이동거리, 위치, 일시정지/자동시작 등이 제대로 작동하지 않습니다. 무엇이 문제일까요? 운동하려는 의지가 확 꺾이려고 하니 얼른 해결해주세요."
446,447,20200916,2020,09,16,4,망태기사랑,매일 아침 걷기 운동을 하는데 컨디션 따라 보폭의 속도가 들쭉날쭉이 되서 아쉬움이 남습니다 그러다 메트로놈 어플을 발견하고 사용해보니 참 편리하네요 걷기 메뉴에 메트로놈 기능을 첨가하여 알람과 함께 본인에게 맞는 속도를 유지할 수 있게 해 주시면 좋을 것 같아요
447,448,20181226,2018,12,26,5,Google 사용자,항상 잘 사용하고 있습니다. 하루 권장 걸음수도 채우면서 매일 사용하는 앱입니다 수면시간 재주는것도 참 좋고 주간활동을 알림으로서 확인시켜주는것도 좋습니다 쓰다보니 칭찬 밖에 없네요 그치만 그정도로 애정하는 앱입니다 항상 업데이트하면서 수고하시는 개발자님들 올 한해 기분 좋게 마무리 하시고 감사합니다.
448,449,20220129,2022,01,29,1,sei rakia,"수면체크 이러기 있습니까? 20넘게 주고 구매했는데 샤오미보다 못하다는 소리를 들었습니다. 1시까지 공부하고 2시쯤 겨우 잠들었는데 왜 수면체크가 10시30분부터 되어있을까요? 오늘 밤을 샜는데 왜 6시간정도 잤다고 기록될까요? 배터리 100퍼센트 채우고 잤고, 산지 겨우 일주일도 안되었습니다. 너무 실망이 큽니다. 걷기 수는 기록이 되는거같은데 제가 걷고있어도 자동체크 되었다 안되었다 하고 배터리는 너무 빨리 달구요. 연락과 삼성헬스때문에 구매했다고 해도 과언이 아닌데 이건 무슨.. 별점 1점 주는건 제 인생에서 기적입니다."
449,450,20200527,2020,05,27,5,원준혁,모든 것이 좋습니다. 투게더에서 경쟁하는 것도 그렇고.하지만제가 버그를 찾았어요! 그게 어떤 버그냐면 홈 화면과 투게더 화면이 반씩 화면이 나옵니다. 이거 빨리 수정해주세요. 혹시 이 리뷰를 보신다면 답글 부탁드립니다!^-^
450,451,20201221,2020,12,21,4,Brown Jimmy,비행기모드에서 알림이 와서 자다가 새벽에 깨길 여러날 ㅠㅠ... 원인을 못찾다가 알림창 히스토리 보고 삼성헬스 알림을 차단하니 소리가 안나네요. 앱은 좋고 잘 쓰고 있는데 이 문제 수정바랍니다. 알림에 항상 걸음수를 올려서 볼수 있게요 ~~
451,452,20200820,2020,08,20,1,해피코리아,먼가 중요한 메뉴 하나가 사라졌네요. 그날 섭취 칼로리 소비 칼로리 저울처럼 생긴 메뉴가 안보이네요. 앱이야 개발자가 개발하든 말든 상관은 안하는데 삼성헬스 전세계 수억명의 사람들이 쓰는데 기존 사용자들의 손에 익은 메뉴하나 사라져버리면 감당 우짜실려고요. 기존 사용자들의 편의성 제공이 최우선이 아닐까요.
452,453,20210115,2021,01,15,5,이남희,만보기기능이며 피트니스프로그램도 많고 넘좋아요^^ 근데 운동타이머에 운동동작이있는동영상과 운동방법설명도 함께 추가되었음합니다 업데이트되어서 좋긴한데 운동기록을 적으면 운동활동량에 따라서 음식칼로리가 얼마나 소모되었는가그런것도 표시되었음합니다그리구 하나더 부탁할것은 업데이트되면 스마트워치기능도 업데이트되어서 좋긴한데요 저는 스마트워치가없어요 스마트워치없이 이삼성헬스앱을 쓰는 사람들위해서 스마트워치없이 만족스럽게 쓸수있게해주세요
453,454,20211002,2021,10,02,5,Nayun Lee,건강을 위해 운동관리용으로 정말 잘 사용을 하고 있었어요. 그런데 업데이트 후 인지 장확한 시점을 알순 없으나 내계정의 닉네임이 '바이러스'라는 단어로 변경되어 있어서 많이 놀랐습니다. 혹시 몰라 바로 앱을 삭제했는데 이것이 가능한 일인가요? 다시 앱 다운하기가 걱정되네요.
454,455,20200225,2020,02,25,5,Google 사용자,움직일수 있도록 동기부여해줘서 너무 좋아요. 음식을 먹는 것도 조절이 되어서 좋아요. 아무생각없이 입에 음식을 넣는 일이 많이 줄었어요. 건강한음식을 먹으려 노력하게되고 칼로리 오버가 되지 않도록 조절하게 되네요. 물도 신경써서 많이 먹게 되었고 커피도 많이 줄였어요. 추천 운동프로그램도 있어서 따라하기도하고 학습도 하게되어서 개인트레이너가 옆에 있는것 같아요. 겔럭시 핏이 항상 저를 체크 해주고 깊은 수면을 체크해주며 수면의 질까지 체크하고 좋은 잠을 자려는 노력을 하게 되었어요. 삼성헬스랑 같이 하니까 재밌고 즐겁게 건강을 챙길 수 있어서 너무 좋아요. 짱 짱 좋습니다.
455,456,20180921,2018,09,21,1,Google 사용자,업데이트 이후에 인터페이스가 완전 비효율 적이고 불편합니다... 전에는 편리하게 잘 사용했는데 자주 사용하던 항목을 찾기에도 어려움이있어요 매일 사용하는데도 익숙치가 않아요.. 이전으로 돌려주세요
456,457,20200727,2020,07,27,4,민민,"운동 결과를 SNS에 공유하고 싶은데, 어플의 공유 기능은 너무 제한적인 것 같네요. 심박수, 소모칼로리를 한개의 사진에 같이 공유하고 싶었는데, 어플의 공유기능으로는 불가능 했어요. 운동시간이나 거리 뿐만 아니라, kcal이나 심박수 등등의 운동 결과 데이터를 사용자가 사진과 함께 원하는 방식으로 편집해서 공유할 수 있게 구현해 주셨으면 좋겠습니다."
457,458,20190831,2019,08,31,5,Google 사용자,"식단부터 심박수, 스트레스, 체중관리까지 제가 원하는 건 다 있어서 정말 좋아요. 아이 낳고 12년 동안 절대 줄지 않았던 몸무게가 조금 느리긴 하지만 3개월 동안 3kg이 줄어드는 걸 보니 목표체중까지 꾸준히 사용하게 될 것 같아요. 게다가 조금씩 힘들 때 권장 운동들 중 할 수 있는 범위에서 참고하니 더 도움되는 듯합니다."
458,459,20190301,2019,03,01,2,Google 사용자,업데이트 이후 식단관리시 기존에는 꾸준히 적용되었던 칼로리섭취량(설정치)이 계속 초기화가 됩니다. 초기화가되면 한끼만 입력을했지만 적정량섭취라고 뜹니다.(설정치가 초기화로 0이 되어버려서) 이문제좀 해결부탁드립니다. 매번 목표설정하기가 번거롭네요. 전에는 문제없었는데 갑자기 이러네요. 수고하세요.
459,460,20190421,2019,04,21,5,Google 사용자,"운동, 식습관을 매일매일 꼼꼼히 체크할 수 있어서 규칙적인 생활습관 잡기에 너무 좋은 것 같아요. 월마다 생기는 걷기 챌린지도 왠지 모르게 도전의식을 불러 일으켜서 운동을 더 많이 할 수 있게 해주는 것 같구요. 아이폰에서 갤럭시로 바꾼 후 가장 만족스러운 앱입니다. 추천!"
460,461,20201122,2020,11,22,1,공부하는 아재,"계속 끊김 현상이 나오네요 예전에는 걸음을 정확히 카운터했는데 요세는 갑자기 멈춰서 작동이 안되네요. 예전에는 체중관리 기능, 카페인섭취량 기록 등 좋은 기능 등이 많았는데 시간이 갈수록 다운그레이드가 되가고 있네요. 기존 개발자분들이 단체로 나간건지... 그리고 소통을 하기위해 댓글을 다는걸로 알고있는데 똑같은 말만 반복적으로 달려있네요 차리리 그럴거면 멘트기능을 없애는게 이미지가 더 좋을 것 같네요 쓴소리해서 죄송합니다. 그동안 애정을 갖고 사용했는데 갈수록 기능이 안좋아져가고 있어 안타까운 마음에 써 봤습니다"
461,462,20220111,2022,01,11,2,dd-jy,걸음수 체크하는 기능으로 잘 쓰고 있습니다. 그런데 계단 층 수를 왜 워치를 써야만 인식하는건지 이해가 안되네요... 원래 예전 버전에는 제공하던 기능이었는데 빠져서 매우 불편합니다. 다시 핸드폰만으로도 계단 층 수 인식 기능 지원해주세요.
462,463,20210117,2021,01,17,3,신아그네스,업데이트 되고서는 음식항목이 너무 간결해졌네요. 좋은 의미로가 아니라 나쁜 의미로요. 간식도 오전간식 오후간식등으로 나뉘는게 좋았는데 없어지고..영양정보도 그래프만있고 숫자가 없어진것도 불편해요. 모자란 영양소 얼마나 모자른지 숫자로 볼수있는게 편했는데..불편해졌네요. 하루 총 탄수화물 단백질 지방도 퍼센테이지만 써있어서 제가 계산해야되는것도 불편해졌어요. 또 몇월며칠에 뭐먹었나 보고싶은데 날짜 셀렉이안되게 되었네요. ㅠㅠ 잘쓰고있었는데..예전버전으로 돌아가고싶네요. 그리고 당류 계산도 되었으면 좋겠습니다.
463,464,20190921,2019,09,21,4,Google 사용자,옴론혈압계 연결해서 사용중인데 데이터 자동받기 시에 전버전에선 받기유무확인창이 뜨고 여러개일 경우 받을데이터 선택가능했는데 버전업되고 그냥 확인없이 다 기록되서 불편합니다. 다른사람 혈압재준거도 다 데이터로 들어오기때문에... 개선바랍니다
464,465,20210418,2021,04,18,1,SEUNGWON JANG,업데이트 이후에 약관동의 새창뜨고 동의누르면 앱을 설정할수 없음(삼성계정 세션이 만료된 상태입니다.삼성 계정에 다시 로그인해주세요)라고 뜨고 확인 버튼만 있는데 누르면 앱이 닫힙니다.어떻게해야 사용할수 있는겁니까? 웹페이지에서 로그인 후에 삼성헬스 시작하기 눌러도 똑같습니다. 사용불가능한건가요?
465,466,20200725,2020,07,25,5,김진아,"전 이 어플로 체중기록을 꾸준히 해와서 다이어트에 도움이 됐어요 만족도가 높은 어플이었어요 근데 왜 체중관리가 서비스 중지 된다고 공지사항에 떴죠? 전 주로 체중기록과 음식기록, 만보기, 카페인 섭취 등을 사용했는데요 체중기록이 없어지면 이 어플은 저에게 쓸모가 없어지는데 ㅜㅜ 그냥 놔두시면 안되나요? 체중관리는 뭔지 모르겠지만 제가 애용하는건 매일 체중을 기록하고 일주일마다 평균을 내주고 그런 항목이거든요 넘 좋은데... 꼭 없애셔야 하나요?"
466,467,20210821,2021,08,21,5,임수린,"대박...진짜 너무 좋아요. 운동관리만 되는줄 알았는데, 식단 분석해서 영양소랑 칼로리 계산뿐만 아니라 수면 시간 관리, 생리주기랑 가임기, 배란일까지 체크 가능하고ㅎㅎ 대박이에요... 이런 앱들 불편하고 괜히 복잡하기만해서 안써왔는데 진짜 편리하고 좋아요! 덕분에 약골인데, 식습관 개선하고 규칙적인 생활 할 수 있게 됐어요! 이 어플 때문이더라도 평생 삼성 폰 쓸렵니다...😘"
467,468,20200306,2020,03,06,1,Google 사용자,리뷰 분명 올려놨는데 앱 지워서 없어진건지 다시 올립니다. 최근에 며칠동안 반복적으로 삼성 헬스 업데이트중이라면서 푸쉬 알림은 알림대로 뜨고 폰은 느려지고 하는데 해결할 방법이 없어서 그냥 앱을 지웠습니다... 비슷한 사례가 앱스토어 리뷰에 있나 해서 찾아왔는데 아무 말이 없어 왜 저러는지 감도 안잡히네요
468,469,20201005,2020,10,05,3,Sun Young Kim,"정말 좋은데요 업데이트 이후로 체중 관리 항목이 없어졌네요. 예전에는 체중 관리를 위해서 몇칼로리 운동해야 하고 섭취해야 하는지, 오늘은 적정하게 관리되었는지를 알려주는 항목이 있었거든요. 그런데 이번에 보니까 사라졌어요! ㅠㅠ 이제 그 항목은 더이상 지원하지 않는 건가요? 정말 유용하게 썼는데 정말 충격적이예요ㅠㅠ"
469,470,20210316,2021,03,16,5,정은진,3년동안 사용해본 결과 다이어트 의지를 불태우는데 가장 도움이 되었네요^^ 포인트 적립도 전보다는 이벤트가 적어져서 아쉽긴 하지만 건강해진 것만으로 만족합니다. 가끔 걸음수가 오류로 인해 안올라가는데 그것만 계속적으로 업데이트 잘해주시면 좋겠네요~
470,471,20210531,2021,05,31,4,일그니,요고이 사용한 이후로 아주 열심히 운동도 하고 참으로 좋으네요.. 자기 관리에 도움도 많이 되고 좋은점이 많아 유익하고 좋아요.. 헌데 이번에 폰을 바꾼 이후로 출석처크란이 없어졌는데 있던게 없어진건지요..? 운동도 하면서 매일매일 출석도 하고 좋았는데..
471,472,20190613,2019,06,13,5,Google 사용자,"전보다 아주 좋아졌어요. 다만 워치에서 측정한 스트레스가 연동이 잘 안되네요 며칠전부터 항시 측정 했고 폰에서 표시도 잘되는데, 전체기록보기를 하면 6월달은 아예 데이터가 없대요."
472,473,20211005,2021,10,05,1,g1933,계속 앱이 백그라운드에 실행이 되고 있는데 완전히 끄는 기능은 없나요? 알림에서 끄기 기능도 않되고 끄고싶어도 끄지지 않는 어플 어플을 사용 하지 않을때도 계속 실행이 되어 배터리만 작살나는 어플..ㅜㅜ
473,474,20220502,2022,05,02,2,김민지,워치 4 사용하고 있습니다 평소에는 자주자주 동기화가 되더니.... 요즘은 동기화도 안되고 계속 로딩만 하네요 폰을.오랫동안 안꺼서 문제인가 싶어서 다시 껐다 켜봐도 여전히 동기화중입니다 최근에 휴대폰 업데이트를 한 후부터 이러고 있는데 수정 부탁드립니다
474,475,20201204,2020,12,04,4,김IN대FP훈,운동 기록을 하고싶은데 편집기능이 없네요. 지난 날짜에 운동 기록을 입력할수있는 기능이 추가되었으면 좋겠어요. 수정)확인하고 편집했어요.답변 감사합니다^^. 다만 그날 날짜 기록화면에서 바로 편집할수 있으면 더 편할거같아요!
475,476,20210119,2021,01,19,4,류법선,"문의사항2) 제 문의가 제대로 전달되지 않은 것 같습니다. 이전 버전에서는 오른 층수 목표를 설정할 수 있었고, 일별로 달성여부 관리가 되었습니다. 그런 기능이 없어졌는지 문의구요 없어졌다면 사유가 궁금합니다. ""걸음수 관리""가 아닙니다"
476,477,20210522,2021,05,22,2,thumbly _,"와치없으면 이제 쓰지말란걸까요 ㅎㅎ 거의 6~7년전에 핸드폰 센서로 가능하던 심박수 스트레스지수는 아예 안되는거같은데 그거 뭐 부정확해서 정확한 기기로 바꾸란걸로 대강 이해했는데, 운동기록 못하게하는건 뭔가요 폰 들고 걷는거외엔 기록이 1도안되네요.. 실내자전거 매일 1시간씩 타고있는데 기록불가"
477,478,20200527,2020,05,27,3,서혜진,앱사용이 어렵다. 전체적으로 자기들만의 리그 같은 느낌.좀더 쉽게 편하게 참여를 하게 하면 안 되나? 첫 사용기간동안 한동안 포인트 획득하기 처음에 보이지도 않게 해놔서 포인트 버림 명상 무료 서비스가 개인적으로 제일 괜찮았음
478,479,20181220,2018,12,20,3,Google 사용자,삼성헬스 걸음수 : 1496 타사 걸음측정 앱(캐...) : 2876 한 두번도 아니고 이렇게 차이 날 때가 많습니다. 출근 시 걸음수가 아래 숫자가 맞는데 삼성헬스는 측정을 못하네요. 동일한 환경인데 왜 그럴까요? 자켓 주머니에 넣고 걸어다니는데 원인이 궁금하네요. 폰이 주머니 안에서 놓인 위치에 따라 인식의 차이가 있는건가요?
479,480,20181223,2018,12,23,1,Google 사용자,"걷기어플이 2가지 깔려있는데, 보통 삼성헬스가 만보기준 500~1000보정도 인식이 안되요. 이정도는 늘상있어서 글안남겼었는데, 타어플 4430보 인식할때 2019보 인식합니다. 그냥 중간에 한번씩은 10분넘게 걸어도 인식을 아예안한다는거에요. 자꾸 설정말씀하시는데 그건 이미 다했어요."
480,481,20200810,2020,08,10,2,reone ko,"칼로리 초과 적정 부족 여부를 직관적으로 알 수 있게 해서 체중관리에 도움을 주던 기능이 사라져 불편하다고 다들 리뷰를 쓰는데 답은 '여기 이 기능과 저기 저 기능을 통해 가능하다'며 일관되게 동문서답이신 듯.. 소모된 칼로리 빼고 먹은 음식 칼로리 더하기 성가시니 원래 기능을 복구해 달라는 요청입니다. '그렇게 하겠다', 또는 '못한다 그 이유는'이 답이 되어야 같은 리뷰에 같은 답변 계속 올리는 일이 없을 거라 생각합니다. 없던 기능을 새로 개발해 달라는 것도 아니고 잘 쓰고 있던 기능 계속 쓰게 해달라는 요청입니다. 그외 유용한 기능은 잘 쓰고 있지만 업데이트 이후 리뷰에 대한 답변 내용이 만족스럽지 않아 별 두개 드립니다."
481,482,20201111,2020,11,11,4,김혜진,갤럭시 핏2 아주 만족하며 쓰고있습니당! 근데 수면이 체크 안될때가 한번 있어요! 핏2에서는 체크가 되었는데 헬스앱에는 체크가 아예 안되었더라구요ㅠㅠ 동기화를 시켜도 그대로고... 제가 직접 입력하는 방법밖에 없나요...?? 직접입력하면 자세한 사항은 알수 없고 네모모양으로 수면시간만 체크되던데... 흑흑 왜 핏2와 헬스앱이 체크가 다른걸까요??
482,483,20191125,2019,11,25,3,Google 사용자,수영하고 로그를 sns에 공유하고있습니다. 그런데 얼마전부터 나만의 이미지로 추가하면 기본이미지에서 변경이 되지 않습니다. (사진촬영 이미지는 추가됨) 그리고 이미지 추가할때 폴더가 한번 지정한 후 변경이 되지 않습니다.
483,484,20190328,2019,03,28,2,Google 사용자,오늘 아침부터 앱실행이 안되고 자꾸 중단 메세지가 뜨면서 앱이 꺼집니다. 폰 재부팅 앱 삭제후 재설치 이것저것 다 해보아도 안됩니다. 전 제폰이 고장난줄 알고 속상해있었는데 리뷰보니 어플자체가 문제가 있는것 같네요. 저같이 앱구동이 안되는 분들이 많으시네요. 빠른 조치 바랍니다. 오전에 앱 안되서 삭제후 재설치하니 전에 입력했던 데이터들이 모조리 없어지고 초기화되네요..ㅡㅡ; 하아..
484,485,20210608,2021,06,08,4,Hyejin Han,잘 사용하고 있습니다. 다만 달리기 챌린지 기능을 잘 사용하고 있는데 10km챌린지를 끝나고 더 긴 구간의 챌린지를 찾아봤는데 없네요. 가능하다면 커스텀 챌린지기능을 만들 수 있게 해주시면 감사하겠습니다. 태블릿 버전도요! :))
485,486,20220226,2022,02,26,4,kyoung Ho Lee,"업데이트 전에는 기록 공유 할때에 지도가 보였는데, 업데이트 후에는 공유 할때에 지도가 안보이고, 사진선택만 하게 되어 있네요. 기존 업데이트 전과 동일하게 공유 진행 시 지도 이미지가 보일수있도록 갸선 요청드립니다."
486,487,20220426,2022,04,26,5,Jangseop Shin,"운동 데이터 (저의 경우는 수영) 에서 심박수가 며칠전 갑자기 없어졌어요...뭐가 문제 있는지요? 좋은 참고사항이었는데... 다시 보는 방법이 있을까요? ▶▶▶답변 달아 주셔ㅛ서 갤워치4와 노트20U 리부팅 했더니 다시 돌아왔네요...오늘 수영하고 확인하니 심박수 잘나옵니다...역시 삼성, 답변 감사드립니다~!"
487,488,20220206,2022,02,06,1,Youngrok Lee,갤럭시20울트라 사용자이며 어제 OS업데이트 이후부터 걸음수 측정이 아예 동작하고 있지 않습니다. 트램블 등 다른 하이킹 어플에서는 동작센서가 정상 작동하며 삼성헬스만 미작동합니다. 웰스토리 연동되는 어플이 삼성헬스뿐인데 난감하네요.
488,489,20190513,2019,05,13,3,Google 사용자,2019년 5월 8일부터 삼성 참과 연동이 안되고 있어요. 삼성 참 자체 고장은 아닌 것 같습니다. 기기이상이라고 생각하고 서비스센터에 가서 새 제품으로 5월 13일에 받아왔어요. 폰으로는 여전히 걸음수 측정이 됩니다. 타기기에서 정보를 받아오는게 안되는 것 같아요. 자동업데이트를 해둬서 그 때쯤에 무슨 업데이트가 있었나보다 생각하고 있습니다.  고쳐주세요.
489,490,20190118,2019,01,18,1,Google 사용자,삼성폰에서는 잘 됬었는데 포코폰으로 바꾼후 앱에서 걸음수가 실행이 안됩니다. 포코폰은 지원이 안돠는건가요... 알림창에 걸음수 표시가 off상태로 되있는상태에서 on으로 활성화가 안됩니다.
490,491,20190130,2019,01,30,5,Google 사용자,삼성헬스는 최고에요. 요즘 먹는거 기록하면서 제가 얼마나 부실한 영양상태인지 파악해서 영양제도 열심히 먹고있습니다. 만보기 어플도 너무 좋아요. 매일마다 6000보 이상 걷기를 목표로 하면서 다니니까 대중교통 이용도 더 즐거워지고 있어요. 나중에 기능이 더 추가가 된다면 체성분 측정기술이랑 홈트레이닝 기능이 더 강화되서 제 건강을 종합적으로 관리할 수 있었으면 합니다. 언제나 응원해요 삼성 ㅋㅋ
491,492,20201229,2020,12,29,4,TD AP,"운동도 되고 걸음도 측정해주고 다 좋은데 다만.. 게임을 할때마다 업데이트 중이라면서 많은 알림음과 엄청난 렉을 가져오네요.. 업데이트는 이해가 가도 게임을 할때만 업데이트를 하고, 게임을 나가면 다시 아무렇지도 않다는듯 정상 화면으로 돌아옵니다. 혹시 게임을 할때 방해하는 기능이 있나요?"
