,id,date,dateYear,dateMonth,dateDay,rating,userName,content
718,719,20210904,2021,09,04,3,Gg g,다 좋은데요 심박수랑 스트레스 지수를 아주 작은 그래프를 통해 보려니 심박수랑 스트레스가 정확히 언제 몇이 나왔는지 알고싶은데 너~~~무 작아서 보기 힘들어요 그리고 수면기록은 아예 정확히 언제 렘수면인지 깊은수면인지 나오지도 않고 아주 작은 그래프를 통해 대충 뭉뚱그려서 알수밖에 없네요 좋은점은 calm을 조금 제공해준다는거? 무료기능밖에 못쓰지만ㅋㅋ 암튼 앞에 쓴 내용말고는 다 좋아요.....ㅠㅠ광고같은거도 딱히없고..
719,720,20221014,2022,10,14,3,MJ Kim,저는 모니모앱과 연동해서 사용하려고 했는데 연동이 안돼요. 모니모측에선 이상없다고 삼성헬스 쪽에 문의하라는데 왜 연동이 안될까요? 계속 데이타권한을 주라는 메세지만 뜨고 아무리 줘도 같은 메세지만 뜨고 헬스앱에서도 연결된 앱이 안보여요. 삭제하고 다시 설치도 해봤지만 같은 현상...ㅠㅠ
720,721,20221015,2022,10,15,4,GoldWing TV,폰 잠금을 설정에서 잠금해제 상태로 사용하게 해주세요 여러 업무적인 이유로 잠금 설정을 하지 않고 사용하고 있습니다 잠금 설정을 해놓으면 장갑을 끼고 일하는 직업이라 엄청 불편 합니다 차라리 앱에서 비밀번호 설정을 하든지 아니면 다른 방식으로 잠금할수 있도록 바꾸어 주면 좋겠습니다.
721,722,20221024,2022,10,24,2,선아허,실제 걸음이랑 갭이 커요ㅜㅜ 새벽운동시 걸음을 체크하는데 오늘 현재 다른앱에서는 7498걸음인데 삼성헬스앱엔 5536걸음이네요..평소랑 똑같이 운동했었는데 이렇게 차이나는건 아닌거 같아요.. 원래 바지주머니에 넣고 운동했는데 아우터에 넣고하니 카운팅이안되다니ㅠㅠ 카운팅이 안될때가많은건 알았지만 이렇게 차이가나다니요.말이안된다고봅니다.
722,723,20221101,2022,11,01,1,김기섭,LG35 폰 사용자인데요.. Lg폰에서 사용이 불가능한가요..ㅠㅠ 엡 설치후 실행창을 열고 로그인 창 눌렸더니 삼성 인터넷 브라우저에서만 사용가능한다고 오류가 떠요.(오류코드:LNK 1004) 사용 하고 싶어도 방법은 모르겠네요..
723,724,20220915,2022,09,15,5,I H,"갤럭시핏2 사용자 입니다. 달리기할때 삼성헬스의 음성을 듣고 싶은데 동시 실행이 불가능합니다. 갤럭시 핏2로 달리기 실행중에 음성(거리,시간) 들을수 있는 옵션이 있습니까?"
724,725,20221020,2022,10,20,4,Jung-Hoon Lee,몸무게 상하한선 설정하는 방법은 없나요? 이전에는 상하한선이 좁게 나타나 그래프가 크게 보였는데요. 현재는 상하한선이 너무 크니 그래프가 평평해졌네요 ㅜㅜ
725,726,20220918,2022,09,18,5,hyon,가민워치 쓰다가 삼성헬스 연동이 안 되어서 그냥 워치4사서 1년 넘게 사용중입니다. 이번에 애플워치가 업데이트 되면서 수영ㅡ킥판잡고 발차기도 인식이 된다던데 갤럭시도 업뎃이 되었으면 좋겠습니다. 그리고 워터락 해제시 물 빼는 시간이 조금 더 길어졌으면 좋겠어요
726,727,20220923,2022,09,23,4,미니모,삼성헬스에 있는 투게더 관련입니다 제가 전에 fitbit를 이용한터라 글로벌 사용자들과 race를 많이 했습니다. 아주 경쟁적이기에 미친듯이 더 걷게 되죠 삼성헬스의 투게더도 도전목표 설정시 기존연락처 사용자로 한정하지 않고 fitbit처럼 글로벌 삼성헬스 사용자로 확대하여 경기를 할 수 있다면 좀 더 활성화 될 수 있지 않을까해서 의견 드립니다 PS : 세부내용은 Fitbit 벤치마크
727,728,20221103,2022,11,03,1,정수연,"업데이트 된 이후로 어플이 이상해요 그냥 아예 측정이 안돼요 수면시간도, 걸음수도 측정이 안됩니다 삼성헬스 어플을 눌러야만 켜지고 그때부터 측정됩니다..."
728,729,20221029,2022,10,29,1,피터,"다른 만보기 어플에 비해 걸음수가 60% 밖에 인식이 안되네요. 그리고 가끔 걸음수가 0으로 동작을 하지 않습니다. 아 오늘 또 걸음수 빵이네요! 다른 어플은 9,900인데 너무 짜증!"
729,730,20220913,2022,09,13,4,gong-e teng,삼성헬스 잘사용하고 있습니다. 다양한 활동 분석시스템은 만족하며 잘 사용중인데 투게더에 다른 사람과 활동공유 기능이 타어플들에 비하면 부족한것 같습니다. 걸음수 뿐만 아니라 여러 항목들을 친구들과 공유하며 운동하고 싶은데 개선 부탁드리겠습니다.
730,731,20220908,2022,09,08,4,서주영,예전에 워치4 달리기하면 1km 마다 기록을 음성으로 알려줬는데 지금은 1km만 지나면 맘대로 기록을 알려줘서 런닝에 집중이 안되내요 증상으로는 0.2km 지났습니다 하고 바로 50m지났습니다 심박수 170입니다 등 달리는 내도록 짧은거리 불특정하게 알려주내요 어떻게해야 예전처럼 될까요
731,732,20220923,2022,09,23,5,김서영,"잘 사용하고 있습니다. 다만 어디가 아프다던지, 평소와 다른 점이나 증상 등이 있으면 기록할 수 있는 기능도 추가되었으면 좋겠습니다. 달력을 통해 증상이 있었던 날을 한 눈에 확인 가능하면 좋겠습니다"
732,733,20221008,2022,10,08,1,Minji Kim,수면 기록을 입력하면 1시간씩 밀려서 저장이 됩니다. (ex.오전 1시 취침-8시 기상 > 오전 12시 취침 7시 기상) 개선 좀 해주세요. 그리고 디자인이 갈수록 구려집니다. 그럴거면 그냥 업데이트를 하지마세요.
733,734,20220829,2022,08,29,1,SOEUN LEE,"플립4입니다. 걸음 측정이 계속 0입니다. 그냥 걷기도 뛰기도, 흔들어봐도 0이고, 런닝머신을 해도 0이고, 등산을 해도 0입니다. 어플 문의하기해서 하란대로 다해봤는데도 안됩니다."
734,735,20220929,2022,09,29,1,바삭강냉,워치와 연동해 이용하려고 처음 실행해봤는데 아래 문구가 뜨면서 앱 실행이 안됩니다ㅜㅜ 어플 삭제 후 다시 설치해도 마찬가지인데 해결 방법이 없을까요? 기기는 S22+입니다. [앱을 설정할 수 없음 Server error occurred. Try again (0x2C#7#524288)]
735,736,20220926,2022,09,26,1,솜비,갤s21+ 랑 갤워액2 사용중인데 운동 중 지멋대로 자꾸 꺼짐 1시간 런닝머신하고 확인했는데 20분 찍혀있고 첨에는 혹시 팔걸이나 그런 곳에 부딪혀서 꺼졌나 했는데 한두번이 아니고 어디 부딪힐 일도 없는 실내운동용 자전거 1시간 타고 확인하니까 9분 찍혀있음. 장난함? 차라리 폰에 타이머 켜놓고 운동해도 이 앱보다 성능 좋겠음. 잘 쓰던건데 최근 계속이럼 업데이트 문젠가 해서 워치 업댓봤는데 업댓도 아님 원래 안이랬는데 이게 뭐임 진짜 짜증나는 최악의 앱으로 변함
736,737,20220715,2022,07,15,3,Jeong in Park,섭취한 음식들을 통해 부족한 영양소들을 채울수 있는 부분이 너무 좋습니다. 그런데 현대인들의 영양제를 통한 영양분 섭취도 있을텐데 그부분도 추가가 되면 좋을것 같습니다. 먹고있는 비타민이나 철분 종류등 다양한 영양제에 대한 리스트와 항목을 추가해주세요^^
737,738,20221026,2022,10,26,4,Yena Kim,어플 다 좋은데 음식기록 하는 거에서 영양정보 부족/적정/과잉 표시해주는 항목에 '당류' 좀 추가시켜주세요 어려운 일 아닐 거 같은데 ㅠㅠ 칼륨같은 건 있으면서 당류는 왜 없나요...
738,739,20221028,2022,10,28,4,박선형,예전에는 워치와 핸폰 걸음수 칼로리 시간이 바로 연동되어서 운동할때 좋았는데 업데이트되고 지금은 연동도 안되고 넘 불편해요
739,740,20220916,2022,09,16,4,김이안,3일전인가부터 걷지도 않는데도 계속 걸음수가 빠르게 올라갑니다. 앱을 업데이트했더니 걸음속도만 조금 느려질뿐 가만있는데도 계속 걸음수가 계수되네요 앱삭제하고 다시 깔아야하나요?
740,741,20221029,2022,10,29,5,ᄏ아야아야,삼성헬스에 연계되어있는 애니핏이 애니핏 플러스로 업그레이드 되어서 업그레이드설치를 했는데 자꾸 업그레이드하라는 문구가 뜨네요. 연결을 애니핏이 아닌 애니핏플러스로 자동 접속되게 해주세요.
741,742,20220927,2022,09,27,5,김재환,쓰는데는 전혀 문제없이 잘 쓰고 있어요 가능하다면 운동 항목중에 스텝퍼운동도 추가 해주셨음 좋겠어요ㅜㅠ 참고 부탁 드릴게요😔
742,743,20221006,2022,10,06,1,storm mael,제대로 된 앱이 하나도 없다~ 자전거만 봐도 완전 별로 ;; 하다 못해 일시정지 정지 기능도 열받는 상황이 많이 일어남
743,744,20220827,2022,08,27,1,꿈꾸는몽이,"핸드폰기기를 플립4로 바꿨는데, 다운받아 실행하니 계속 아래같은 에러가뜨고 안되네요 앱을 지웠다가 다시 다운받아도 마찬가지고요 앱을 설정할수 없음 server error occurred. Try again(0x2C#7#524288)"
744,745,20220915,2022,09,15,4,Hagoll jam tv핵꿀잼 티비,수영 구간기록보기 ux 개악된거 고쳐주세요 가로로 보기를 스와이프도 아니고 맨위에 화살표 버튼으로 이동이라니... 90년대인줄 글씨 작아도 되니 한번에 확인가능하게 하거나 스와이프로 바꿔주시거나ㅜ하면 좋을 것 겉어요
745,746,20220903,2022,09,03,5,김지욱,다 좋은데 갤워치5로 바꿨는데 달리기상세분석과 땀손실 등이 안나와요. 어디서 보나요? 웨어러블에서는 소프트웨어는 최신상태라고 합니다.
746,747,20221015,2022,10,15,4,HeeDong _69,바로 직전 업데이트에서 수면 시간이 조정이 안 되어 이번 업데이트에서는 될 줄 알았는데 아직 안 되네요. 수면 시간을 줄이려 했더니 늘일 수 없고 줄일 수만 있다는 메시지만 나오고 안 줄여지네요. 확인 후 수정 부탁드려요.
747,748,20220910,2022,09,10,5,이채린,안뇽하세요. 잘 쓰고 있습니다. 한 가지 건의 사항이 있는데요. 일일활동을 캘린더처럼 보여주는 곳에서 하트 모양을 다 채웠을 때만 하트 색이 선명했으면 좋겠어요. 목표를 다 채우지 못하면 흐릿한 색으로 표현하면 안될까요?? 한 날 안한 날 구분이 명확하면 좋겠어요!!!
748,749,20221026,2022,10,26,5,luck c,안녕하세요. 노트8기기를 z플립4로 기기변경시 헬스앱에 기록했던 이전의 내용들도 삼성계정으로 로그인하면 그대로 넘어오나요~?
749,750,20221013,2022,10,13,4,박지인,다 좋아요 근데 몇 가지 고쳤으면 하는게 있습니다 1. 운동 시간 편집 - 까먹고 종료 안했을 때 다 지우기도 애매하고 그대로 두기도 그래요 2. 영양소 당 표시 - 당 관리하고 싶은데 안떠서 보기가 힘들어요
750,751,20221028,2022,10,28,5,코끼리아재,저번에 업데이트 이후로 운동할때 이동거리멘트가 짤려요. 6km면 육키로미 까지만 멘트를 하더라고요. 고칠수없나요? 별거 아니지만 계속 신경쓰이네요.
751,752,20221017,2022,10,17,5,S2흰동,"삼성헬스 서비스들 다 좋은데, 주 일일걸음수 확인할때 간단한 일기를 작성할 수 있는 서비스를 같이 제공한다면,어플을 더 재밌게 잘 쓸거 같아요!"
752,753,20220921,2022,09,21,3,이정경,어제부터 운동기록이 제대로 저장이 되지않고 있습니다 활동시간 활동칼로리가 제대로 되지않아요 갑자기 왜 그럴까요? 운동기록만남고 입력이 안되고 있습니다
753,754,20220908,2022,09,08,5,일하기시렁,만보기 작동 안되던것 해결됨. 플립4 구매하고 하루 20걸음만 측정됐는데 어제 폰업데이트 하니까 이제 잘 작동되네요. 역시 사전예약은 돈주고 테스터 자원하는 입장이랄까... 그래도 개선해주니 다행이에요.
754,755,20220911,2022,09,11,4,장승덕,"8월에 업데이트이후같은 거리를 달렸는데 거리가 짪게 나오네요 한 20%정도, 예전에 6km로 나오던 거리가5kn로... 다른 어플과 비교해도 그러네요;;"
755,756,20220829,2022,08,29,4,조순희,심박수체크?이젠 않되나요 예전엔 됐었는데 지금은 수기 기록만 가능한가봅니다 아님 제가 헤매는건지도 가늠이 않되긴합니다만... 빠른 답변을 해주셔서 감사합니다 5G에서는 않되는군요 이젠 건강을 염려해야하는 나이때라서 예전처럼 뭔가를 체크해보려고 어플을 둘러봤으나 않보이기에 리뷰를 남겼고 이해됐습니다 웨어러블.워치 당장은 없기에 다른 어플 설치했습니다 감사합니다^^
756,757,20220825,2022,08,25,3,K은하수,업데이트가 되지 않고 핸드폰 전원을 껏다 키면 삼성헬스앱이 원인으로 무한부팅이 되어서 제거후 다시 깔려고 하는데 2일동안 계속 제거 중 표시만 뜹니다. 해결방안이 있을까요?
757,758,20220910,2022,09,10,1,백수정,전에는 로그인을 안해도 간단하게 사용이 가능했는데 지금은 2단계 인증까지 요구해서 사용하는데 불편함이 너무 크네요 사용하지 말라고 하는거지 사용하라고 만든건 아니라는 생각이 드네요 이 앱 삭제하고 더 좋은 헬스앱을 찾는게 나을듯 합니다
758,759,20221020,2022,10,20,5,이도경,"걸음수탭에서 이전의 걸음수가 없어졌습니다. 주간, 월간 모두 확인됐었는데 없어져서 아쉽습니다."
759,760,20221101,2022,11,01,2,Ryan Park,기록 공유 할때 페이스 거리 숫자들 검정색이라 사진이 조금이라도 어두우면 하나도 안 보여요... 원래대로 돌려주세요..
760,761,20221022,2022,10,22,3,권영기,업데이트 이후 피쿡 체중계랑 연결이 안되네요 이전에도 안되다 다시 연결되더니 또 그러네요ㅠㅠ 왜그런거죠? 폰 기종은 폴드4입니다
761,762,20221022,2022,10,22,1,HN tice,워치에 실시간으로 심박수가 나타나질 않습니다. 심박수 측정도 안하는거 같은대 버그 픽스좀 해주세요
762,763,20221022,2022,10,22,1,이민,업데이트이후 스트라바로 업로드가 안됩니다. 경로내보내기 gpx파일 기능도 사라졌구요..
763,764,20220822,2022,08,22,3,jhaetserl khim,기어2 네오를 사용중이던 애국자인데 웨어러블이 업데이트 되며 등록이 안되어 만보기 기능을 못 사용합니다! 센터에 문의하니 오래된 기기라 서비스중단되었다는데 늙으면 다 폐기하는 겁니까? 서글퍼서 하소연해봅니다
764,765,20220826,2022,08,26,5,T LA (sable),안녕하세요 너무 잘 사용하고 있는데 음식 입력 후 영양성분의 총량을 볼 수 있는 항목에서 '당'을 볼 수 있게 개선되면 좋겠어요
765,766,20220915,2022,09,15,4,june P,걸음수가 이상합니다. 기존 갤럭시 핏이나 다른기기에 비해 숫자가 비슷하게 나오다 어느 순간 10000보가까이 상승하는듯 합니다. 사무직인데 매일 2만보라뇨... 기존엔 6천보 내외였는데 워치5사용중입니다만.. 기기오류인가요? 앱 오류인가요??
766,767,20221016,2022,10,16,2,아쿠마,업데이트 후 공유시 수영의 평균페이스 표기방식이 달라져서 비교하기 번거롭다. 100m당 시간에서 지금은 뭘 기준으로 나타내는지 모르겠다. 그리고 원래도 타어플에 비해 공유할 수 있는 내용이 부족하다.
767,768,20220805,2022,08,05,3,한국인,일주일에 3~4번 정도 달리기를 하는데 개선좀 해 주었으면 하는데 기록에 보면 구간 시간 페이스 3가지가 나오는데 페이스 부분수정 예를들어 시간이 5분이면 속도가 12km로 나오게끔 속도로 수정해 주었으면 합니다 그리고 구간도 1km에서 0.5km 마다 볼수 있으면 합니다.
768,769,20210305,2021,03,05,1,Sung-Ju Ji,"메인 페이지 Dashboard가 정말 쓸모없네요. 하루에 소모한 칼로리 및 운동량을 한눈에 확인할 수 있는 UI도 없고, 하루 칼로리 목표 설정을 했는데도 워치에서는 칼로리 트래킹 기능이 동작하지도 않고 안되고..전반적으로 점점 쓸모없어지는것 같아요. 상단바에 광고같은거 띄우지말고 health app답게 운동량 및 칼로리 카운터가 있으면 좋을것같습니다. 대부분의 UI의 real estate가 비효율적으로 활용된다는 느낌입니다. 수면 대시보드는 그나마 UI적으로나, 보여지는 내용이 도움이됩니다. 전반적으로 그냥 백그라운드에서 걸음카운터로 사용하는거 외에는 타사앱에 비해 현저히 사용성과 유용성이 떨어집니다. Peloton bike와 같은 유명한 home equipment와 연동을 support하지않는 점도 매우 아쉽습니다. 삼성헬스는 그냥 삼성에서 버리는 앱같네요..초반부터 사용해왔던 유저로서 매우 아쉽습니다."
769,770,20220925,2022,09,25,4,김대중,"잘 쓰고있는데요, 걷다가 차를 타고 이동할 때 깜빡하고 안끄는 경우가 많아요. 일부를 삭제할 수 있는 기능을 넣어주시면 좋겠습니다."
770,771,20221021,2022,10,21,4,이재율,헬스 어플이 좋습니다 근데 계단 오르기 운동은 핸드폰으로 측정이 안되는거 같던데 측정 될수 있게 개선을 요청합니다
771,772,20220706,2022,07,06,2,이남매하우스,어느순간부터 운동기록이 제대로 되질않네요.. 동기화를 해보고 제거하고 다시 깔아도 걸음수는 체크되는데 운동기록 들어가면 기록이 안뜨니 답답합니다!!!!!
772,773,20220831,2022,08,31,5,박진형,잘 사용하고 있는 사람입니다만 수정할 부분이 있어서요..걷기 안내멘트에서 에서 4km지나고 다음이 5km인데 6km라고 합니다. 벌써 6km를 걸었나 깜짝 놀랩니다.수정해쥬세요
773,774,20220716,2022,07,16,4,강태안,혈압체크 기능이 왜 갤럭시만 되는지요. 스마트워치가 엄연히 독립된 건강체커 아닌가요. 처음부터 광고에 오로지 갤럭시만을 위한 제품이라고 안내를 해야지 안드로이드폰은 전부되는것인양 호도하면 소비자가 기분 나쁘겠죠. 타사폰에서도 작동할수있게 길을 터놓으시죠... 폼으로 달고다니는게 아닌데 모든이의 건강을 위한다면 타사제품도 사용할수있게 해주세요.
774,775,20220928,2022,09,28,1,Grace Lim,운동 칼로리 측정이 엉터리로 되는데 검색해 보니 앱 내 문의하기 메뉴로 보고하라고 하길래 문의하기를 누르니 계속 로딩만 뜨고 어떻게 해도 연결이 안 됩니다 뭐하자는 건지...
775,776,20220824,2022,08,24,5,모현준이,잘쓰고있습니다 근데 무서운게 제가 운동을 새벽에 하거덩여? 근데 얘가 km당 페이스랑 심박수 이런거 얘기할때 잘 얘기하다가 음이 뭐라해야하지? 귀신음같은게 들려요 나 그럴때 마다 무서워서 미치겠는데 운동은 해야겠고 계속 그러면 몰라 일정 구간만 가면 기계음 목소리 늘~~어지면서 막 소름끼치게 만들어요 이게 말로는 표현이 안됨 근데 어플은 좋아서 별점 높아요 ㅋㅋ 그거 좀 고쳐주세요 아님 일정구간에서 그러는데 거기가 문제인가요? 기계음 늘어지게 했다가 안했다가 하니까 나 미쳐요! 그래서 그거 고쳐지기 전까지 나이키러닝쓸래요..
776,777,20220812,2022,08,12,4,클레오파트라슈,2년정도 매일 꾸준히 사용하고 있습니다 근데 최근 업데이트를 했는지 식사를 입력할때 최근에 추기한 음식 리스트가 다 사라졌어요ㅠㅠㅠㅠ저는 먹는 음식이 거기서 거기라 그걸 애용했는데 요 4일동안 사라지는 바람에 다시 입력하고 있어요ㅠㅠㅠㅠㅠ다시는 이런일 없게 해주세요ㅠㅠㅠㅠ
777,778,20221012,2022,10,12,2,Parov,"걷기나 달리기 운동시 거리, 시간이 맞지 않음. 걸음 수, 운동, 일일활동에서 데이터가 다름."
778,779,20221026,2022,10,26,4,양진아,걷기중 음성안내가 0.5단위로 알려주도록 되어있는데 1키로도 1키로 1.5키로도 1키로라고 합니다. 0.5를 인식하지못합니다 뿌엥ㅡㅡ;;
779,780,20200813,2020,08,13,5,Jongran Han (Ran),유용하게 잘 쓰고 있습니다. 건강관리에 많은 도움이 됩니다. 앱을 제대로 활용하기 위해 워치까지 샀습니다. 다만 이번 업데이트로 체중관리 항목이 사라졌는데 유용하게 썼던지라 많이 아쉽네요. 향후 돌아왔으면 하는 바람입니다. 또한 심박 그래프 색상도 예전에는 대비가 뚜렷하여 직관적이이였는데 업데이트 후 비슷한 노랑-빨강 계열로 통일되어 한눈에 알아보기 힘들어졌습니다.
780,781,20220908,2022,09,08,5,한선구 (한나라),최근 앱이 배터리를 많이 사용하는 것으로 나타납니다. 전체 사용량의 30% 이상 점유하는 곳으로 보입니다 확인해 주시면 고맙겠습니다
781,782,20221002,2022,10,02,5,차영훈,런닝머신 이용시 본인이 운동한 기록을 사진을 찍으면 달린 km가 등록되거나 직접입력 할 수 있으면 합니다 그 외에는 매우 만족입니다
782,783,20220913,2022,09,13,5,안인광,"만보기가 작동안해요. 다시 깔아도 봤고 , 인터넷에서 애기하는 위치허용 등 다 해봤는데도 안돼네요 모바일 재부팅 방법 설명좀"
783,784,20220903,2022,09,03,1,Hyun mi Jeong,노트9로 잘 사용중 이였는데 업뎃이후 사용이 안되네요? 2단계인증 하래서 하는데 계속 오류납니다
784,785,20220828,2022,08,28,2,ps jung,노트9에서 s22 울트라로 넘어왔는데 심박수및 산소포화도가 입력이 안되네요. 설정을 잘못했나요?
785,786,20220902,2022,09,02,4,6.8M Draco,라이딩하면서 잘쓰고있어요 다만 고도가 정확하지 않습니다 언덕을 오르고 있는데 마이너스%로 뜨는 경우도 있네요
786,787,20220922,2022,09,22,1,김나리,갤럭시S22 사용중인데 웰스토리 헬스라이프로그(전에 쓰던 노트10에서 이렇게 나옴)쪽 화면 안나오고 계속 로딩중인데 진짜 너무 거슬리는데 없애주세요 삭제하려고해도 삭제안됨 진심 너무 꼴뵈기싫습니다
787,788,20220909,2022,09,09,1,Victoria. KIM,왜 0걸음에서 바뀌지 않을까요.. 앱한테 권한 다주고 자전거를 타도 뛰어도 걸어도 0걸음에서 바뀌질 않네요...
788,789,20220907,2022,09,07,5,유병열,오늘아침 운동을매일매일하는데 아침부터 안돼서 다시깔았어요 왜그런증상이 나타나지요 걷기운동을 매일매일하는데 오늘만그런현상이아침에 생겨서 다시걷기을하니까 제대로됐어요
789,790,20221005,2022,10,05,3,별빛천지,코골이 녹음된게 한번들으면 없어지나요? 오늘새벽에 코골이 2분 측정되었는데 다시들어보려고하니 기록된 코골이가 없다고 나옵니다
790,791,20221001,2022,10,01,1,레츠,다른 어플들이랑 충돌하는거같아요 자동측정끄고나니 폰이 제멋대로 움직이고 꺼지는게 사라졌어요
791,792,20220826,2022,08,26,5,juju Kim,다 좋은데 유모차끌고 걷기운동할때 자꾸 멈춰요. 팔을 안움직여서 그런지ㅠㅠ 이거만 개선됐음 좋겠는데
792,793,20220907,2022,09,07,2,정문경,이번에 폴드4로 바꾸고 핸드폰가주고 다니는데 어느순간부터 걸어다니는데 핸드폰에 걸음수가 0입니다~~업뎃하고 안돼는거 같네요~~
793,794,20220923,2022,09,23,2,문미라,업데이트 한 후 차가 흔들리거나 조수석에 놓아도 걸음수가 측정되서 하루 100만보가 찍혀서 정상적으로 활용할 수가 없네요
794,795,20220920,2022,09,20,4,이현준,"갤럭시워치4 업데이트 이후 삼성헬스로 운동 시 지도표시가 안됩니다.(워치, 폰 둘 다)"
795,796,20220827,2022,08,27,4,송노총각,사용하다보면 조금씩 알게됨. 심심하지 않음. 하루에 한번씩 신체리듬 건강을 확인 해보세요.
796,797,20221008,2022,10,08,3,이재웅,구글 피트니스와 연동이 가능하게 되었으면 좋겠습니다 워치os도 바뀌었는데 언제쯤 가능할 지 궁금합니다
797,798,20221007,2022,10,07,3,beloved Korea My,"운동 남은시간, 운동시간, 칼로리 세 개 표시되던거 왜 남은시간 표기 안 되는 방식으로 업데이트 된 건가요?// 그리고 일일활동을 (세개 하트 포개진 화면) > 달력으로 볼 때 (달성)걸음수/(목표)걸음수로 보이던 내용이 (달성)걸음수/(목표)활동시간 으로 표기되네요. 그 밑에도 또 기존처럼 (달성)활동시간/(목표)활동시간 나와요. 그니까 (목표)활동시간이 두 번 표기돼요. 오류인 것 같아요."
798,799,20220917,2022,09,17,3,Ashley K,플립4로 폰을 바꾸고 동기화가 잘 되었는데 어제부터 갑자기 걸음 수가 사라지거나 아예 0으로 카운트되는데 왜이런가요?
799,800,20220913,2022,09,13,1,히나,스트레스 더 주면서 측정하는거는 왜있냐?? ㅋㅋ 열받아뒤지세요냐?? --^ 움직이지도 않고 손 띄지도 않았는데 뭔 손띄었다고 그럼??
